{
  "$schema": "https://json-schema.org/draft/2020-12/schema",
  "$id": "https://github.com/yexi-fun/PetAgent/market/manifest.schema.json",
  "title": "PetAgent Plugin Manifest",
  "type": "object",
  "additionalProperties": false,
  "required": ["schemaVersion", "id", "name", "version", "apiVersion", "petAgent", "type", "description", "entry", "targets", "sha256", "signature", "signingKeyId"],
  "properties": {
    "schemaVersion": { "const": 1 },
    "id": { "type": "string", "pattern": "^[a-z0-9]+(?:[.-][a-z0-9]+)+$", "maxLength": 128 },
    "name": { "type": "string", "minLength": 1, "maxLength": 80 },
    "version": { "type": "string", "pattern": "^(0|[1-9][0-9]*)\\.(0|[1-9][0-9]*)\\.(0|[1-9][0-9]*)(?:-[0-9A-Za-z.-]+)?(?:\\+[0-9A-Za-z.-]+)?$" },
    "apiVersion": { "const": 1 },
    "petAgent": { "type": "string", "minLength": 1 },
    "type": { "enum": ["mcp", "sidecar", "provider", "native-dll", "frontend"] },
    "description": { "type": "string", "minLength": 1, "maxLength": 500 },
    "entry": {
      "type": "object",
      "additionalProperties": false,
      "required": ["kind"],
      "properties": {
        "kind": { "enum": ["mcp", "sidecar", "provider", "native-dll", "frontend"] },
        "config": { "$ref": "#/$defs/relativePath" },
        "executable": { "$ref": "#/$defs/relativePath" },
        "library": { "$ref": "#/$defs/relativePath" },
        "serviceName": { "type": "string" },
        "serviceApiVersion": { "type": "integer", "minimum": 1 }
      }
    },
    "dependencies": { "type": "array", "uniqueItems": true, "items": { "type": "object", "additionalProperties": false, "required": ["id", "version"], "properties": { "id": { "type": "string" }, "version": { "type": "string" } } } },
    "conflicts": { "type": "array", "uniqueItems": true, "items": { "type": "string" } },
    "permissions": { "type": "array", "uniqueItems": true, "items": { "enum": ["network", "filesystem-read", "filesystem-write", "shell", "model", "window", "microphone"] } },
    "targets": { "type": "array", "minItems": 1, "uniqueItems": true, "items": { "enum": ["windows-x64", "windows-arm64"] } },
    "configSchema": { "$ref": "#/$defs/relativePath" },
    "sha256": { "type": "string", "pattern": "^[A-Fa-f0-9]{64}$" },
    "signature": { "type": "string", "minLength": 40 },
    "signingKeyId": { "type": "string", "minLength": 1 }
  },
  "$defs": {
    "relativePath": { "type": "string", "pattern": "^(?![A-Za-z]:)(?!/)(?!.*(?:^|/)\\.\\.(?:/|$))[^\\\\]+$" }
  }
}
