{
  "schemaVersion": 1,
  "id": "com.example.echo",
  "name": "Echo MCP",
  "version": "0.1.0",
  "apiVersion": 1,
  "petAgent": ">=0.1.0 <0.2.0",
  "type": "mcp",
  "description": "A minimal MCP server that echoes text.",
  "entry": {
    "kind": "mcp",
    "config": "runtime/mcp.json"
  },
  "dependencies": [],
  "conflicts": [],
  "permissions": [],
  "targets": ["windows-x64"],
  "configSchema": "config.schema.json",
  "sha256": "0000000000000000000000000000000000000000000000000000000000000000",
  "signature": "GENERATED_BY_PROTECTED_RELEASE_WORKFLOW_0000000000000000000000000000000000000000",
  "signingKeyId": "publisher-key-com-example-2026-01"
}
